sent,tags,parse
"The bishop told us how German youth had been going to the devil : smoking , dancing , staying out late nights , and so forth , when along came a Wundermensch , a worker of miracles , who inspired them , mobilized them in national service , and inspired them to devote their lives to das Volk .","The/DT bishop/NN told/VBD us/PRP how/WRB German/JJ youth/NN had/VBD been/VBN going/VBG to/TO the/DT devil/NNP :/: smoking/NN ,/, dancing/NN ,/, staying/VBG out/RP late/JJ nights/NNS ,/, and/CC so/RB forth/RB ,/, when/WRB along/RB came/VBD a/DT Wundermensch/NNP ,/, a/DT worker/NN of/IN miracles/NNS ,/, who/WP inspired/VBD them/PRP ,/, mobilized/VBD them/PRP in/IN national/JJ service/NN ,/, and/CC inspired/VBD them/PRP to/TO devote/VB their/PRP$ lives/NNS to/TO das/NNP Volk/NNP ./."," det(bishop-2, The-1) nsubj(told-3, bishop-2) root(ROOT-0, told-3) dobj(told-3, us-4) advmod(going-10, how-5) amod(youth-7, German-6) nsubj(going-10, youth-7) aux(going-10, had-8) aux(going-10, been-9) dep(told-3, going-10) case(devil-13, to-11) det(devil-13, the-12) nmod:to(going-10, devil-13) nsubj(staying-19, smoking-15) nsubj(mobilized-43, smoking-15) appos(smoking-15, dancing-17) parataxis(told-3, staying-19) compound:prt(staying-19, out-20) amod(nights-22, late-21) nmod:tmod(staying-19, nights-22) cc(staying-19, and-24) advmod(forth-26, so-25) advmod(mobilized-43, forth-26) advmod(came-30, when-28) advmod(came-30, along-29) advcl(mobilized-43, came-30) det(Wundermensch-32, a-31) dobj(came-30, Wundermensch-32) nsubj(inspired-40, Wundermensch-32) det(worker-35, a-34) appos(Wundermensch-32, worker-35) case(miracles-37, of-36) nmod:of(worker-35, miracles-37) ref(Wundermensch-32, who-39) acl:relcl(Wundermensch-32, inspired-40) dobj(inspired-40, them-41) parataxis(told-3, mobilized-43) conj:and(staying-19, mobilized-43) dobj(mobilized-43, them-44) case(service-47, in-45) amod(service-47, national-46) nmod:in(mobilized-43, service-47) cc(mobilized-43, and-49) conj:and(staying-19, inspired-50) conj:and(mobilized-43, inspired-50) dobj(inspired-50, them-51) nsubj(devote-53, them-51) mark(devote-53, to-52) xcomp(inspired-50, devote-53) nmod:poss(lives-55, their-54) dobj(devote-53, lives-55) case(Volk-58, to-56) compound(Volk-58, das-57) nmod:to(devote-53, Volk-58)  "
"As the voice of collective tribal memory , Red Dress appears to Harley Wind Soldier in 1982 during a vision , telling him that as a grass dancer "" when you move through those old steps ... you are dancing a rebellion "" ( 299 ) .","As/IN the/DT voice/NN of/IN collective/JJ tribal/JJ memory/NN ,/, Red/NNP Dress/NNP appears/VBZ to/TO Harley/NNP Wind/NNP Soldier/NNP in/IN 1982/CD during/IN a/DT vision/NN ,/, telling/VBG him/PRP that/IN as/IN a/DT grass/NN dancer/NN ''/'' when/WRB you/PRP move/VBP through/IN those/DT old/JJ steps/NNS .../: you/PRP are/VBP dancing/VBG a/DT rebellion/NN ''/'' -LRB-/-LRB- 299/VB -RRB-/-RRB- ./."," case(voice-3, As-1) det(voice-3, the-2) nmod:as(appears-11, voice-3) case(memory-7, of-4) amod(memory-7, collective-5) amod(memory-7, tribal-6) nmod:of(voice-3, memory-7) compound(Dress-10, Red-9) nsubj(appears-11, Dress-10) root(ROOT-0, appears-11) case(Soldier-15, to-12) compound(Soldier-15, Harley-13) compound(Soldier-15, Wind-14) nmod:to(appears-11, Soldier-15) case(1982-17, in-16) nmod:in(Soldier-15, 1982-17) case(vision-20, during-18) det(vision-20, a-19) nmod:during(appears-11, vision-20) xcomp(appears-11, telling-22) nsubj(move-32, him-23) dep(move-32, that-24) case(dancer-28, as-25) det(dancer-28, a-26) compound(dancer-28, grass-27) nmod:as(that-24, dancer-28) advmod(move-32, when-30) nsubj(move-32, you-31) xcomp(telling-22, move-32) case(steps-36, through-33) det(steps-36, those-34) amod(steps-36, old-35) nmod:through(move-32, steps-36) nsubj(dancing-40, you-38) aux(dancing-40, are-39) parataxis(move-32, dancing-40) det(rebellion-42, a-41) dobj(dancing-40, rebellion-42) dep(appears-11, 299-45)  "
sup84 <p> De la Rosa likewise was responsible for initiating a new style of playing the accordion that significantly impacted Tejano dancing .,sup84/JJ <p>/NN De/NNP la/NNP Rosa/NNP likewise/RB was/VBD responsible/JJ for/IN initiating/VBG a/DT new/JJ style/NN of/IN playing/VBG the/DT accordion/NN that/WDT significantly/RB impacted/VBD Tejano/NNP dancing/NN ./.," amod(Rosa-5, sup84-1) compound(Rosa-5, <p>-2) compound(Rosa-5, De-3) compound(Rosa-5, la-4) nsubj(responsible-8, Rosa-5) advmod(responsible-8, likewise-6) cop(responsible-8, was-7) root(ROOT-0, responsible-8) mark(initiating-10, for-9) advcl(responsible-8, initiating-10) det(style-13, a-11) amod(style-13, new-12) dobj(initiating-10, style-13) mark(playing-15, of-14) acl(style-13, playing-15) det(accordion-17, the-16) dobj(playing-15, accordion-17) nsubj(impacted-20, accordion-17) ref(accordion-17, that-18) advmod(impacted-20, significantly-19) acl:relcl(accordion-17, impacted-20) compound(dancing-22, Tejano-21) dobj(impacted-20, dancing-22)  "
"This new , slower sound directly created a dancing style known as ( el ) tacuachito.","This/DT new/JJ ,/, slower/JJR sound/NN directly/RB created/VBD a/DT dancing/NN style/NN known/VBN as/IN -LRB-/-LRB- el/NN -RRB-/-RRB- tacuachito/NN ./."," det(sound-5, This-1) amod(sound-5, new-2) amod(sound-5, slower-4) nsubj(created-7, sound-5) advmod(created-7, directly-6) root(ROOT-0, created-7) det(style-10, a-8) compound(style-10, dancing-9) dobj(created-7, style-10) acl(style-10, known-11) case(tacuachito-16, as-12) appos(tacuachito-16, el-14) nmod:as(known-11, tacuachito-16)  "
"Third , the Tejano dancing population made few demands for complexity in the music or for virtuosity in its musicians .","Third/LS ,/, the/DT Tejano/NNP dancing/NN population/NN made/VBD few/JJ demands/NNS for/IN complexity/NN in/IN the/DT music/NN or/CC for/IN virtuosity/NN in/IN its/PRP$ musicians/NNS ./."," advmod(made-7, Third-1) det(population-6, the-3) compound(population-6, Tejano-4) compound(population-6, dancing-5) nsubj(made-7, population-6) nsubj(made-7', population-6) root(ROOT-0, made-7) conj:or(made-7, made-7') amod(demands-9, few-8) dobj(made-7, demands-9) case(complexity-11, for-10) nmod:for(made-7, complexity-11) case(music-14, in-12) det(music-14, the-13) nmod:in(made-7, music-14) cc(made-7, or-15) case(virtuosity-17, for-16) nmod:for(made-7', virtuosity-17) case(musicians-20, in-18) nmod:poss(musicians-20, its-19) nmod:in(virtuosity-17, musicians-20)  "
Before it was danced with a quick loop in the manner of Polish or German polka dancing .,Before/IN it/PRP was/VBD danced/VBN with/IN a/DT quick/JJ loop/NN in/IN the/DT manner/NN of/IN Polish/NNP or/CC German/JJ polka/NN dancing/NN ./.," advmod(danced-4, Before-1) nsubjpass(danced-4, it-2) auxpass(danced-4, was-3) root(ROOT-0, danced-4) case(loop-8, with-5) det(loop-8, a-6) amod(loop-8, quick-7) nmod:with(danced-4, loop-8) case(manner-11, in-9) det(manner-11, the-10) nmod:in(loop-8, manner-11) case(Polish-13, of-12) nmod:of(manner-11, Polish-13) cc(Polish-13, or-14) amod(dancing-17, German-15) compound(dancing-17, polka-16) nmod:of(manner-11, dancing-17) conj:or(Polish-13, dancing-17)  "
They use dancing songs in there now .,They/PRP use/VBP dancing/VBG songs/NNS in/IN there/RB now/RB ./.," nsubj(use-2, They-1) root(ROOT-0, use-2) xcomp(use-2, dancing-3) dobj(dancing-3, songs-4) case(there-6, in-5) nmod:in(songs-4, there-6) advmod(dancing-3, now-7)  "
"<p> Once a week members of Nnim Etim would meet to entertain it by playing drums , dancing , and eating .","<p>/NN Once/IN a/DT week/NN members/NNS of/IN Nnim/NNP Etim/NNP would/MD meet/VB to/TO entertain/VB it/PRP by/IN playing/VBG drums/NNS ,/, dancing/VBG ,/, and/CC eating/VBG ./."," nsubj(meet-10, <p>-1) nsubj(entertain-12, <p>-1) case(members-5, Once-2) det(members-5, a-3) compound(members-5, week-4) nmod:once(<p>-1, members-5) case(Etim-8, of-6) compound(Etim-8, Nnim-7) nmod:of(members-5, Etim-8) aux(meet-10, would-9) root(ROOT-0, meet-10) mark(entertain-12, to-11) xcomp(meet-10, entertain-12) dobj(entertain-12, it-13) mark(playing-15, by-14) advcl(entertain-12, playing-15) dobj(playing-15, drums-16) advcl(entertain-12, dancing-18) conj:and(playing-15, dancing-18) cc(playing-15, and-20) advcl(entertain-12, eating-21) conj:and(playing-15, eating-21)  "
"For example , a drum pattern and song title in spirit possession songs called tan daman denotes "" something quickly done and fleeting , "" and this lacks connotations of extravagance or wastefulness ; rather it is connected to beauty in songs , poetry , and dancing ( Rasmussen 1995 ) .","For/IN example/NN ,/, a/DT drum/JJ pattern/NN and/CC song/NN title/NN in/IN spirit/NN possession/NN songs/NNS called/VBD tan/NN daman/NN denotes/NNS ''/'' something/NN quickly/RB done/VBN and/CC fleeting/JJ ,/, ''/'' and/CC this/DT lacks/VBZ connotations/NNS of/IN extravagance/NN or/CC wastefulness/NNS ;/: rather/RB it/PRP is/VBZ connected/VBN to/TO beauty/NN in/IN songs/NNS ,/, poetry/NN ,/, and/CC dancing/NN -LRB-/-LRB- Rasmussen/NNP 1995/CD -RRB-/-RRB- ./."," case(example-2, For-1) nmod:for(called-14, example-2) det(pattern-6, a-4) amod(pattern-6, drum-5) nsubj(called-14, pattern-6) cc(pattern-6, and-7) compound(title-9, song-8) conj:and(pattern-6, title-9) nsubj(called-14, title-9) case(songs-13, in-10) compound(songs-13, spirit-11) compound(songs-13, possession-12) nmod:in(pattern-6, songs-13) root(ROOT-0, called-14) compound(denotes-17, tan-15) compound(denotes-17, daman-16) dobj(called-14, denotes-17) dobj(called-14, something-19) conj:and(denotes-17, something-19) advmod(done-21, quickly-20) acl(something-19, done-21) cc(denotes-17, and-22) dobj(called-14, fleeting-23) conj:and(denotes-17, fleeting-23) cc(called-14, and-26) nsubj(lacks-28, this-27) conj:and(called-14, lacks-28) dobj(lacks-28, connotations-29) case(extravagance-31, of-30) nmod:of(connotations-29, extravagance-31) cc(extravagance-31, or-32) nmod:of(connotations-29, wastefulness-33) conj:or(extravagance-31, wastefulness-33) advmod(connected-38, rather-35) nsubjpass(connected-38, it-36) auxpass(connected-38, is-37) parataxis(called-14, connected-38) case(beauty-40, to-39) nmod:to(connected-38, beauty-40) case(songs-42, in-41) nmod:in(beauty-40, songs-42) nmod:in(beauty-40, poetry-44) conj:and(songs-42, poetry-44) cc(songs-42, and-46) nmod:in(beauty-40, dancing-47) conj:and(songs-42, dancing-47) appos(songs-42, Rasmussen-49) nummod(Rasmussen-49, 1995-50)  "
"Cultural elements like music , dancing , food , and language are present in rural Mardi Gras .","Cultural/NNP elements/NNS like/VBP music/NN ,/, dancing/NN ,/, food/NN ,/, and/CC language/NN are/VBP present/JJ in/IN rural/JJ Mardi/NNP Gras/NNP ./."," compound(elements-2, Cultural-1) nsubj(like-3, elements-2) root(ROOT-0, like-3) dobj(like-3, music-4) dobj(like-3, dancing-6) conj:and(music-4, dancing-6) dobj(like-3, food-8) conj:and(music-4, food-8) cc(music-4, and-10) dobj(like-3, language-11) conj:and(music-4, language-11) cop(present-13, are-12) acl:relcl(music-4, present-13) case(Gras-17, in-14) amod(Gras-17, rural-15) compound(Gras-17, Mardi-16) nmod:in(present-13, Gras-17)  "
Many others ( particularly the young people ) stay for the singing and dancing which continue until dawn .,Many/JJ others/NNS -LRB-/-LRB- particularly/RB the/DT young/JJ people/NNS -RRB-/-RRB- stay/VBP for/IN the/DT singing/NN and/CC dancing/NN which/WDT continue/VBP until/IN dawn/NN ./.," amod(others-2, Many-1) nsubj(stay-9, others-2) dep(people-7, particularly-4) det(people-7, the-5) amod(people-7, young-6) appos(others-2, people-7) root(ROOT-0, stay-9) case(singing-12, for-10) det(singing-12, the-11) nmod:for(stay-9, singing-12) nsubj(continue-16, singing-12) cc(singing-12, and-13) nmod:for(stay-9, dancing-14) conj:and(singing-12, dancing-14) nsubj(continue-16, dancing-14) ref(singing-12, which-15) acl:relcl(singing-12, continue-16) case(dawn-18, until-17) nmod:until(continue-16, dawn-18)  "
"dancing , hug/cuddle , sixty-nine ) , whereas the 6 least concordant behaviors fell between 63% and 67% agreement ( e.g.","dancing/VB ,/, hug/cuddle/NN ,/, sixty-nine/JJ -RRB-/-RRB- ,/, whereas/IN the/DT 6/CD least/JJS concordant/NN behaviors/NNS fell/VBD between/IN 63/CD %/NN and/CC 67/CD %/NN agreement/NN -LRB-/-LRB- e.g./IN"," root(ROOT-0, dancing-1) nsubj(agreement-21, hug/cuddle-3) amod(hug/cuddle-3, sixty-nine-5) mark(fell-14, whereas-8) det(behaviors-13, the-9) nummod(behaviors-13, 6-10) amod(behaviors-13, least-11) compound(behaviors-13, concordant-12) nsubj(fell-14, behaviors-13) dep(hug/cuddle-3, fell-14) amod(%-17, between-15) nummod(%-17, 63-16) dobj(fell-14, %-17) cc(%-17, and-18) nummod(%-20, 67-19) dobj(fell-14, %-20) conj:and(%-17, %-20) xcomp(dancing-1, agreement-21) acl(agreement-21, e.g.-23)  "
"The 3 behaviors which women rated as more comfortable ( cuddling together , giving partner a hug , and dancing ) were among the least explicitly sexual of all the behaviors polled .","The/DT 3/CD behaviors/NNS which/WDT women/NNS rated/VBD as/RB more/RBR comfortable/JJ -LRB-/-LRB- cuddling/VBG together/RB ,/, giving/VBG partner/NN a/DT hug/NN ,/, and/CC dancing/VBG -RRB-/-RRB- were/VBD among/IN the/DT least/JJS explicitly/JJ sexual/NN of/IN all/PDT the/DT behaviors/NNS polled/VBN ./."," det(behaviors-3, The-1) nummod(behaviors-3, 3-2) dobj(comfortable-9, behaviors-3) nsubj(sexual-27, behaviors-3) ref(behaviors-3, which-4) nsubj(rated-6, women-5) acl:relcl(behaviors-3, rated-6) advmod(comfortable-9, as-7) advmod(comfortable-9, more-8) xcomp(rated-6, comfortable-9) parataxis(sexual-27, cuddling-11) advmod(cuddling-11, together-12) conj:and(cuddling-11, giving-14) parataxis(sexual-27, giving-14) iobj(giving-14, partner-15) det(hug-17, a-16) dobj(giving-14, hug-17) cc(cuddling-11, and-19) conj:and(cuddling-11, dancing-20) parataxis(sexual-27, dancing-20) cop(sexual-27, were-22) case(sexual-27, among-23) det(sexual-27, the-24) dep(explicitly-26, least-25) amod(sexual-27, explicitly-26) root(ROOT-0, sexual-27) case(behaviors-31, of-28) det:predet(behaviors-31, all-29) det(behaviors-31, the-30) nmod:of(sexual-27, behaviors-31) acl(behaviors-31, polled-32)  "
"Clearly some forms of "" expression "" -nude dancing , for example -- merit little or no First Amendment protection .","Clearly/RB some/DT forms/VBZ of/IN ''/'' expression/NN ''/'' -/: nude/JJ dancing/NN ,/, for/IN example/NN --/: merit/NN little/JJ or/CC no/DT First/NNP Amendment/NNP protection/NN ./."," advmod(forms-3, Clearly-1) nsubj(forms-3, some-2) root(ROOT-0, forms-3) case(expression-6, of-4) nmod:of(forms-3, expression-6) amod(dancing-10, nude-9) nmod:of(forms-3, dancing-10) conj:or(expression-6, dancing-10) case(example-13, for-12) nmod:for(dancing-10, example-13) dep(dancing-10, merit-15) dep(merit-15, little-16) cc(expression-6, or-17) neg(protection-21, no-18) compound(protection-21, First-19) compound(protection-21, Amendment-20) nmod:of(forms-3, protection-21) conj:or(expression-6, protection-21)  "
"And dance -- at least in the 1960s , at least when Yvonne Rainer is dancing -- is a deeply oppositional affair .","And/CC dance/NN --/: at/IN least/JJS in/IN the/DT 1960s/NNS ,/, at/IN least/JJS when/WRB Yvonne/NNP Rainer/NNP is/VBZ dancing/VBG --/: is/VBZ a/DT deeply/RB oppositional/JJ affair/NN ./."," cc(affair-22, And-1) nsubj(affair-22, dance-2) advmod(1960s-8, at-4) mwe(at-4, least-5) case(1960s-8, in-6) det(1960s-8, the-7) nmod:in(dance-2, 1960s-8) case(least-11, at-10) advmod(1960s-8, least-11) advmod(dancing-16, when-12) compound(Rainer-14, Yvonne-13) nsubj(dancing-16, Rainer-14) aux(dancing-16, is-15) acl:relcl(1960s-8, dancing-16) cop(affair-22, is-18) det(affair-22, a-19) advmod(oppositional-21, deeply-20) amod(affair-22, oppositional-21) root(ROOT-0, affair-22)  "
"( n15 ) What Rainer would later denounce as the "" narcissism , and disguised sexual exhibitionism of most dancing "" was expressed , in Duet , by pinup posing ; that is , by literally "" registering like a photograph . ""","-LRB-/-LRB- n15/NNP -RRB-/-RRB- What/WP Rainer/NNP would/MD later/RB denounce/VB as/RB the/DT ''/'' narcissism/NN ,/, and/CC disguised/JJ sexual/JJ exhibitionism/NN of/IN most/JJS dancing/NN ''/'' was/VBD expressed/VBN ,/, in/IN Duet/NNP ,/, by/IN pinup/NN posing/VBG ;/: that/WDT is/VBZ ,/, by/IN literally/RB ''/'' registering/VBG like/IN a/DT photograph/NN ./. ''/''"," root(ROOT-0, n15-2) dobj(registering-38, n15-2) ref(n15-2, What-4) nsubj(denounce-8, Rainer-5) aux(denounce-8, would-6) advmod(denounce-8, later-7) acl:relcl(n15-2, denounce-8) advmod(the-10, as-9) dobj(denounce-8, the-10) nsubj(literally-36, the-10) nsubjpass(expressed-23, narcissism-12) cc(narcissism-12, and-14) amod(exhibitionism-17, disguised-15) amod(exhibitionism-17, sexual-16) conj:and(narcissism-12, exhibitionism-17) nsubjpass(expressed-23, exhibitionism-17) case(dancing-20, of-18) amod(dancing-20, most-19) nmod:of(exhibitionism-17, dancing-20) auxpass(expressed-23, was-22) acl:relcl(the-10, expressed-23) case(Duet-26, in-25) nmod:in(expressed-23, Duet-26) case(pinup-29, by-28) nmod:by(expressed-23, pinup-29) nsubj(literally-36, pinup-29) acl(pinup-29, posing-30) ref(the-10, that-32) ref(pinup-29, that-32) cop(literally-36, is-33) case(literally-36, by-35) acl:relcl(pinup-29, literally-36) xcomp(denounce-8, registering-38) case(photograph-41, like-39) det(photograph-41, a-40) nmod:like(registering-38, photograph-41)  "
"<p> "" If my rage at the impoverishment of ideas , narcissism , and disguised sexual exhibitionism of most dancing can be considered puritan moralizing , "" wrote Rainer in the program notes distributed at the debut of The Mind is a Muscle , "" it is also true that I love the body -- its actual weight , mass , and unenhanced physicality.","<p>/NN ''/'' If/IN my/PRP$ rage/NN at/IN the/DT impoverishment/NN of/IN ideas/NNS ,/, narcissism/NN ,/, and/CC disguised/VBN sexual/JJ exhibitionism/NN of/IN most/JJS dancing/NN can/MD be/VB considered/VBN puritan/NN moralizing/NN ,/, ''/'' wrote/VBD Rainer/NNP in/IN the/DT program/NN notes/NNS distributed/VBN at/IN the/DT debut/NN of/IN The/DT Mind/NNP is/VBZ a/DT Muscle/NN ,/, ''/'' it/PRP is/VBZ also/RB true/JJ that/IN I/PRP love/VBP the/DT body/NN --/: its/PRP$ actual/JJ weight/NN ,/, mass/NN ,/, and/CC unenhanced/JJ physicality/NN ./."," nsubj(Muscle-43, <p>-1) mark(considered-23, If-3) nmod:poss(rage-5, my-4) nsubjpass(considered-23, rage-5) case(impoverishment-8, at-6) det(impoverishment-8, the-7) nmod:at(rage-5, impoverishment-8) case(ideas-10, of-9) nmod:of(impoverishment-8, ideas-10) appos(ideas-10, narcissism-12) cc(impoverishment-8, and-14) amod(exhibitionism-17, disguised-15) amod(exhibitionism-17, sexual-16) nmod:at(rage-5, exhibitionism-17) conj:and(impoverishment-8, exhibitionism-17) case(dancing-20, of-18) amod(dancing-20, most-19) nmod:of(exhibitionism-17, dancing-20) aux(considered-23, can-21) auxpass(considered-23, be-22) advcl(wrote-28, considered-23) compound(moralizing-25, puritan-24) dobj(considered-23, moralizing-25) acl:relcl(<p>-1, wrote-28) dobj(wrote-28, Rainer-29) case(notes-33, in-30) det(notes-33, the-31) compound(notes-33, program-32) nmod:in(Rainer-29, notes-33) acl(notes-33, distributed-34) case(debut-37, at-35) det(debut-37, the-36) nmod:at(distributed-34, debut-37) case(Mind-40, of-38) det(Mind-40, The-39) nmod:of(debut-37, Mind-40) cop(Muscle-43, is-41) det(Muscle-43, a-42) root(ROOT-0, Muscle-43) nsubj(true-49, it-46) cop(true-49, is-47) advmod(true-49, also-48) dep(Muscle-43, true-49) mark(love-52, that-50) nsubj(love-52, I-51) ccomp(true-49, love-52) det(body-54, the-53) dobj(love-52, body-54) nmod:poss(weight-58, its-56) amod(weight-58, actual-57) dep(Muscle-43, weight-58) dep(Muscle-43, mass-60) conj:and(weight-58, mass-60) cc(weight-58, and-62) amod(physicality-64, unenhanced-63) dep(Muscle-43, physicality-64) conj:and(weight-58, physicality-64)  "
"For Rainer once described her dance project as "" thinking of oneself in dancing as a neutral purveyor of information . """,For/IN Rainer/NNP once/RB described/VBD her/PRP$ dance/NN project/NN as/IN ''/'' thinking/NN of/IN oneself/PRP in/IN dancing/VBG as/IN a/DT neutral/JJ purveyor/NN of/IN information/NN ./. ''/''," dep(described-4, For-1) nsubj(described-4, Rainer-2) advmod(described-4, once-3) root(ROOT-0, described-4) nmod:poss(project-7, her-5) compound(project-7, dance-6) dobj(described-4, project-7) case(thinking-10, as-8) nmod:as(described-4, thinking-10) case(oneself-12, of-11) nmod:of(thinking-10, oneself-12) mark(dancing-14, in-13) advcl(described-4, dancing-14) case(purveyor-18, as-15) det(purveyor-18, a-16) amod(purveyor-18, neutral-17) nmod:as(dancing-14, purveyor-18) case(information-20, of-19) nmod:of(purveyor-18, information-20)  "
"Rainer wants to dance as a "" neutral purveyor of information ; "" Hay says "" i am dancing breath . """,Rainer/NNP wants/VBZ to/TO dance/VB as/IN a/DT ''/'' neutral/JJ purveyor/NNS of/IN information/NN ;/: ''/'' Hay/NNP says/VBZ ''/'' i/NNP am/VBP dancing/VBG breath/NN ./. ''/''," nsubj(wants-2, Rainer-1) nsubj(dance-4, Rainer-1) root(ROOT-0, wants-2) mark(dance-4, to-3) xcomp(wants-2, dance-4) case(a-6, as-5) advmod(dance-4, a-6) amod(purveyor-9, neutral-8) dobj(dance-4, purveyor-9) case(information-11, of-10) nmod:of(purveyor-9, information-11) nsubj(dancing-19, Hay-14) acl:relcl(Hay-14, says-15) nmod:tmod(says-15, i-17) aux(dancing-19, am-18) dep(wants-2, dancing-19) dobj(dancing-19, breath-20)  "
"Moreover , it specifically contested the spectacularization inherent to most of this dancing , which Rainer conceptualized as a photograph-like effect .","Moreover/RB ,/, it/PRP specifically/RB contested/VBD the/DT spectacularization/NN inherent/JJ to/TO most/JJS of/IN this/DT dancing/NN ,/, which/WDT Rainer/NNP conceptualized/VBD as/IN a/DT photograph-like/JJ effect/NN ./."," advmod(contested-5, Moreover-1) nsubj(contested-5, it-3) advmod(contested-5, specifically-4) root(ROOT-0, contested-5) det(spectacularization-7, the-6) nsubj(inherent-8, spectacularization-7) xcomp(contested-5, inherent-8) case(most-10, to-9) nmod:to(inherent-8, most-10) case(dancing-13, of-11) det(dancing-13, this-12) nmod:of(most-10, dancing-13) dobj(conceptualized-17, dancing-13) ref(dancing-13, which-15) nsubj(conceptualized-17, Rainer-16) acl:relcl(dancing-13, conceptualized-17) case(effect-21, as-18) det(effect-21, a-19) amod(effect-21, photograph-like-20) nmod:as(conceptualized-17, effect-21)  "
And Yvonne Rainer is always dancing around the problem of the photograph .,And/CC Yvonne/NNP Rainer/NNP is/VBZ always/RB dancing/VBG around/IN the/DT problem/NN of/IN the/DT photograph/NN ./.," cc(dancing-6, And-1) compound(Rainer-3, Yvonne-2) nsubj(dancing-6, Rainer-3) aux(dancing-6, is-4) advmod(dancing-6, always-5) root(ROOT-0, dancing-6) case(problem-9, around-7) det(problem-9, the-8) nmod:around(dancing-6, problem-9) case(photograph-12, of-10) det(photograph-12, the-11) nmod:of(problem-9, photograph-12)  "
Tutus of varied colors for the dancing princesses and a special ribboned tutu for the beautiful Princess Vasalisa were purchased .,Tutus/NNS of/IN varied/JJ colors/NNS for/IN the/DT dancing/NN princesses/NNS and/CC a/DT special/JJ ribboned/JJ tutu/NN for/IN the/DT beautiful/JJ Princess/NNP Vasalisa/NNP were/VBD purchased/VBN ./.," nsubjpass(purchased-20, Tutus-1) case(colors-4, of-2) amod(colors-4, varied-3) nmod:of(Tutus-1, colors-4) case(princesses-8, for-5) det(princesses-8, the-6) compound(princesses-8, dancing-7) nmod:for(colors-4, princesses-8) cc(colors-4, and-9) det(tutu-13, a-10) amod(tutu-13, special-11) amod(tutu-13, ribboned-12) nmod:of(Tutus-1, tutu-13) conj:and(colors-4, tutu-13) case(Vasalisa-18, for-14) det(Vasalisa-18, the-15) amod(Vasalisa-18, beautiful-16) compound(Vasalisa-18, Princess-17) nmod:for(tutu-13, Vasalisa-18) auxpass(purchased-20, were-19) root(ROOT-0, purchased-20)  "
"A dancing story is called a ballet . """,A/DT dancing/NN story/NN is/VBZ called/VBN a/DT ballet/JJ ./. ''/''," det(story-3, A-1) compound(story-3, dancing-2) nsubjpass(called-5, story-3) auxpass(called-5, is-4) root(ROOT-0, called-5) det(ballet-7, a-6) dobj(called-5, ballet-7)  "
"Therefore , what is worthwhile is not the cry of those who stay , but the sound of music and the pleasure of a mulatto girl tap dancing on top of the coffin .","Therefore/RB ,/, what/WP is/VBZ worthwhile/JJ is/VBZ not/RB the/DT cry/NN of/IN those/DT who/WP stay/VBP ,/, but/CC the/DT sound/NN of/IN music/NN and/CC the/DT pleasure/NN of/IN a/DT mulatto/NN girl/NN tap/VB dancing/NN on/IN top/NN of/IN the/DT coffin/NN ./."," advmod(cry-9, Therefore-1) nsubj(worthwhile-5, what-3) cop(worthwhile-5, is-4) csubj(cry-9, worthwhile-5) cop(cry-9, is-6) neg(cry-9, not-7) det(cry-9, the-8) root(ROOT-0, cry-9) case(those-11, of-10) nmod:of(cry-9, those-11) nsubj(stay-13, those-11) ref(those-11, who-12) acl:relcl(those-11, stay-13) cc(cry-9, but-15) det(sound-17, the-16) nsubj(tap-27, sound-17) case(music-19, of-18) nmod:of(sound-17, music-19) cc(sound-17, and-20) det(pleasure-22, the-21) conj:and(sound-17, pleasure-22) nsubj(tap-27, pleasure-22) case(girl-26, of-23) det(girl-26, a-24) compound(girl-26, mulatto-25) nmod:of(pleasure-22, girl-26) conj:but(cry-9, tap-27) dobj(tap-27, dancing-28) case(coffin-33, on-29) mwe(on-29, top-30) mwe(on-29, of-31) det(coffin-33, the-32) nmod:on_top_of(tap-27, coffin-33)  "
"In 1776 Sutherland was hanging out with the slaves in Virginia , dancing a "" Kongo minuet . ""","In/IN 1776/CD Sutherland/NNP was/VBD hanging/VBG out/RP with/IN the/DT slaves/NNS in/IN Virginia/NNP ,/, dancing/VBG a/NNP ''/'' Kongo/NNP minuet/JJ ./. ''/''"," case(1776-2, In-1) nmod:in(hanging-5, 1776-2) nsubj(hanging-5, Sutherland-3) aux(hanging-5, was-4) root(ROOT-0, hanging-5) compound:prt(hanging-5, out-6) case(slaves-9, with-7) det(slaves-9, the-8) nmod:with(hanging-5, slaves-9) case(Virginia-11, in-10) nmod:in(slaves-9, Virginia-11) advcl(hanging-5, dancing-13) compound(Kongo-16, a-14) nsubj(minuet-17, Kongo-16) xcomp(dancing-13, minuet-17)  "
