sent,tags,parse
<p> Dance sharing : communicating with others through dancing and responding to and recording dance .,<p>/NNP Dance/NNP sharing/NNP :/: communicating/VBG with/IN others/NNS through/IN dancing/VBG and/CC responding/VBG to/TO and/CC recording/VBG dance/NN ./.," compound(sharing-3, <p>-1) compound(sharing-3, Dance-2) root(ROOT-0, sharing-3) parataxis(sharing-3, communicating-5) case(others-7, with-6) nmod:with(communicating-5, others-7) mark(dancing-9, through-8) advcl(communicating-5, dancing-9) cc(dancing-9, and-10) advcl(communicating-5, responding-11) conj:and(dancing-9, responding-11) nmod(dancing-9, to-12) cc(communicating-5, and-13) parataxis(sharing-3, recording-14) conj:and(communicating-5, recording-14) dobj(recording-14, dance-15)  "
"Children were presented with the opportunities to perform in singing and dancing and to to gain eye/hand coordination , dexterity , and accuracy .","Children/NNP were/VBD presented/VBN with/IN the/DT opportunities/NNS to/TO perform/VB in/IN singing/VBG and/CC dancing/VBG and/CC to/TO to/TO gain/VB eye/hand/JJ coordination/NN ,/, dexterity/RB ,/, and/CC accuracy/NN ./."," nsubjpass(presented-3, Children-1) nsubj(perform-8, Children-1) auxpass(presented-3, were-2) root(ROOT-0, presented-3) case(opportunities-6, with-4) det(opportunities-6, the-5) nmod:with(presented-3, opportunities-6) mark(perform-8, to-7) xcomp(presented-3, perform-8) mark(singing-10, in-9) nmod(perform-8, singing-10) cc(singing-10, and-11) nmod(perform-8, dancing-12) conj:and(singing-10, dancing-12) cc(singing-10, and-13) case(gain-16, to-14) mark(gain-16, to-15) nmod(perform-8, gain-16) conj:and(singing-10, gain-16) amod(coordination-18, eye/hand-17) dobj(gain-16, coordination-18) dep(gain-16, dexterity-20) cc(gain-16, and-22) conj:and(singing-10, accuracy-23) conj:and(gain-16, accuracy-23)  "
"The only time she does truly lead is when she is dancing , and then her followers are women .","The/DT only/JJ time/NN she/PRP does/VBZ truly/RB lead/JJ is/VBZ when/WRB she/PRP is/VBZ dancing/VBG ,/, and/CC then/RB her/PRP$ followers/NNS are/VBP women/NNS ./."," det(time-3, The-1) amod(time-3, only-2) nsubj(is-8, time-3) nsubj(does-5, she-4) acl:relcl(time-3, does-5) advmod(lead-7, truly-6) dobj(does-5, lead-7) root(ROOT-0, is-8) advmod(dancing-12, when-9) nsubj(dancing-12, she-10) aux(dancing-12, is-11) advcl(is-8, dancing-12) cc(is-8, and-14) advmod(women-19, then-15) nmod:poss(followers-17, her-16) nsubj(women-19, followers-17) cop(women-19, are-18) conj:and(is-8, women-19)  "
"In the complicated choreography of social interaction , we are perhaps not "" dancing with wolves "" but with fellow fleas.","In/IN the/DT complicated/JJ choreography/NN of/IN social/JJ interaction/NN ,/, we/PRP are/VBP perhaps/RB not/RB ''/'' dancing/VBG with/IN wolves/NNS ''/'' but/CC with/IN fellow/JJ fleas/NNS ./."," case(choreography-4, In-1) det(choreography-4, the-2) amod(choreography-4, complicated-3) nmod:in(not-12, choreography-4) case(interaction-7, of-5) amod(interaction-7, social-6) nmod:of(choreography-4, interaction-7) nsubj(not-12, we-9) cop(not-12, are-10) advmod(not-12, perhaps-11) root(ROOT-0, not-12) acl(not-12, dancing-14) case(wolves-16, with-15) nmod:with(dancing-14, wolves-16) cc(fleas-21, but-18) case(fleas-21, with-19) amod(fleas-21, fellow-20) nmod:with(dancing-14, fleas-21)  "
"Sometimes as many as nine reindeer from the herds are sacrificed ( if the people can afford such extravagance ) , and on the last day of the festival there may be an all-night marathon of dancing and singing sacred ancestral songs .","Sometimes/RB as/RB many/JJ as/IN nine/CD reindeer/NN from/IN the/DT herds/NNS are/VBP sacrificed/VBN -LRB-/-LRB- if/IN the/DT people/NNS can/MD afford/VB such/JJ extravagance/NN -RRB-/-RRB- ,/, and/CC on/IN the/DT last/JJ day/NN of/IN the/DT festival/NN there/EX may/MD be/VB an/DT all-night/JJ marathon/NN of/IN dancing/VBG and/CC singing/VBG sacred/JJ ancestral/JJ songs/NNS ./."," advmod(sacrificed-11, Sometimes-1) advmod(nine-5, as-2) advmod(nine-5, many-3) advmod(nine-5, as-4) nummod(reindeer-6, nine-5) nsubjpass(sacrificed-11, reindeer-6) case(herds-9, from-7) det(herds-9, the-8) nmod:from(reindeer-6, herds-9) auxpass(sacrificed-11, are-10) root(ROOT-0, sacrificed-11) mark(afford-17, if-13) det(people-15, the-14) nsubj(afford-17, people-15) aux(afford-17, can-16) parataxis(sacrificed-11, afford-17) amod(extravagance-19, such-18) dobj(afford-17, extravagance-19) cc(sacrificed-11, and-22) case(day-26, on-23) det(day-26, the-24) amod(day-26, last-25) nmod:on(marathon-35, day-26) case(festival-29, of-27) det(festival-29, the-28) nmod:of(day-26, festival-29) expl(marathon-35, there-30) aux(marathon-35, may-31) cop(marathon-35, be-32) det(marathon-35, an-33) amod(marathon-35, all-night-34) conj:and(sacrificed-11, marathon-35) mark(dancing-37, of-36) acl(marathon-35, dancing-37) cc(dancing-37, and-38) acl(marathon-35, singing-39) conj:and(dancing-37, singing-39) amod(songs-42, sacred-40) amod(songs-42, ancestral-41) dobj(dancing-37, songs-42)  "
"<p> Only men took part in the dress performance , while women enthusiastically participated in the mixed dancing that followed .","<p>/JJ Only/JJ men/NNS took/VBD part/NN in/IN the/DT dress/NN performance/NN ,/, while/IN women/NNS enthusiastically/RB participated/VBD in/IN the/DT mixed/JJ dancing/NN that/WDT followed/VBD ./."," amod(men-3, <p>-1) amod(men-3, Only-2) nsubj(took-4, men-3) root(ROOT-0, took-4) dobj(took-4, part-5) case(performance-9, in-6) det(performance-9, the-7) compound(performance-9, dress-8) nmod:in(took-4, performance-9) mark(participated-14, while-11) nsubj(participated-14, women-12) advmod(participated-14, enthusiastically-13) advcl(took-4, participated-14) case(dancing-18, in-15) det(dancing-18, the-16) amod(dancing-18, mixed-17) nmod:in(participated-14, dancing-18) nsubj(followed-20, dancing-18) ref(dancing-18, that-19) acl:relcl(dancing-18, followed-20)  "
"According to American anthropologist Marjorie Mandelstam Balzer , bawdy dancing and gender reversals may be included in the traditional ritual dramas , with males traditionally taking women 's parts in the plays and being uninhibited in their female impersonations , but I did not witness this .","According/VBG to/TO American/JJ anthropologist/NN Marjorie/NNP Mandelstam/NNP Balzer/NNP ,/, bawdy/JJ dancing/NN and/CC gender/NN reversals/NNS may/MD be/VB included/VBN in/IN the/DT traditional/JJ ritual/NN dramas/NN ,/, with/IN males/NNS traditionally/RB taking/VBG women/NNS 's/POS parts/NNS in/IN the/DT plays/NNS and/CC being/VBG uninhibited/VBN in/IN their/PRP$ female/JJ impersonations/NNS ,/, but/CC I/PRP did/VBD not/RB witness/VB this/DT ./."," case(Balzer-7, According-1) mwe(According-1, to-2) amod(Balzer-7, American-3) compound(Balzer-7, anthropologist-4) compound(Balzer-7, Marjorie-5) compound(Balzer-7, Mandelstam-6) nmod:according_to(included-16, Balzer-7) amod(dancing-10, bawdy-9) nsubjpass(included-16, dancing-10) cc(dancing-10, and-11) compound(reversals-13, gender-12) conj:and(dancing-10, reversals-13) nsubjpass(included-16, reversals-13) aux(included-16, may-14) auxpass(included-16, be-15) root(ROOT-0, included-16) case(dramas-21, in-17) det(dramas-21, the-18) amod(dramas-21, traditional-19) compound(dramas-21, ritual-20) nmod:in(included-16, dramas-21) mark(taking-26, with-23) nsubj(taking-26, males-24) nsubjpass(uninhibited-35, males-24) advmod(taking-26, traditionally-25) advcl(included-16, taking-26) nmod:poss(parts-29, women-27) case(women-27, 's-28) dobj(taking-26, parts-29) case(plays-32, in-30) det(plays-32, the-31) nmod:in(parts-29, plays-32) cc(taking-26, and-33) auxpass(uninhibited-35, being-34) advcl(included-16, uninhibited-35) conj:and(taking-26, uninhibited-35) case(impersonations-39, in-36) nmod:poss(impersonations-39, their-37) amod(impersonations-39, female-38) nmod:in(uninhibited-35, impersonations-39) cc(included-16, but-41) nsubj(witness-45, I-42) aux(witness-45, did-43) neg(witness-45, not-44) conj:but(included-16, witness-45) dobj(witness-45, this-46)  "
"In his opinion , this wedding in Scotland was far better , because there was music and dancing in the island tradition .","In/IN his/PRP$ opinion/NN ,/, this/DT wedding/NN in/IN Scotland/NNP was/VBD far/RB better/JJR ,/, because/IN there/EX was/VBD music/NN and/CC dancing/NN in/IN the/DT island/NN tradition/NN ./."," case(opinion-3, In-1) nmod:poss(opinion-3, his-2) nmod:in(better-11, opinion-3) det(wedding-6, this-5) nsubj(better-11, wedding-6) case(Scotland-8, in-7) nmod:in(wedding-6, Scotland-8) cop(better-11, was-9) advmod(better-11, far-10) root(ROOT-0, better-11) mark(was-15, because-13) expl(was-15, there-14) advcl(better-11, was-15) nsubj(was-15, music-16) cc(music-16, and-17) nsubj(was-15, dancing-18) conj:and(music-16, dancing-18) case(tradition-22, in-19) det(tradition-22, the-20) compound(tradition-22, island-21) nmod:in(music-16, tradition-22)  "
"Multicultural events included an international dinner Native American Powwow and ethnic dancing , storytelling , and Cultural performances .","Multicultural/JJ events/NNS included/VBD an/DT international/JJ dinner/NN Native/JJ American/NNP Powwow/NNP and/CC ethnic/JJ dancing/NN ,/, storytelling/NN ,/, and/CC Cultural/NNP performances/NNS ./."," amod(events-2, Multicultural-1) nsubj(included-3, events-2) root(ROOT-0, included-3) det(international-5, an-4) dobj(included-3, international-5) dep(Powwow-9, dinner-6) amod(Powwow-9, Native-7) compound(Powwow-9, American-8) nmod(included-3, Powwow-9) cc(Powwow-9, and-10) amod(storytelling-14, ethnic-11) compound(storytelling-14, dancing-12) nmod(included-3, storytelling-14) conj:and(Powwow-9, storytelling-14) cc(Powwow-9, and-16) compound(performances-18, Cultural-17) nmod(included-3, performances-18) conj:and(Powwow-9, performances-18)  "
"One I recall was square dancing at a social mixer when my partner for the set asked me what my major was ; upon learning that it was astrophysics , he walked off the dance floor , leaving seven of us to improvise .","One/CD I/NN recall/NN was/VBD square/JJ dancing/NN at/IN a/DT social/JJ mixer/NN when/WRB my/PRP$ partner/NN for/IN the/DT set/NN asked/VBD me/PRP what/WP my/PRP$ major/NN was/VBD ;/: upon/IN learning/VBG that/IN it/PRP was/VBD astrophysics/JJ ,/, he/PRP walked/VBD off/RP the/DT dance/NN floor/NN ,/, leaving/VBG seven/CD of/IN us/PRP to/TO improvise/VB ./."," nummod(recall-3, One-1) compound(recall-3, I-2) nsubj(dancing-6, recall-3) cop(dancing-6, was-4) amod(dancing-6, square-5) ccomp(walked-32, dancing-6) case(mixer-10, at-7) det(mixer-10, a-8) amod(mixer-10, social-9) nmod:at(dancing-6, mixer-10) dobj(was-22, mixer-10) advmod(asked-17, when-11) nmod:poss(partner-13, my-12) nsubj(asked-17, partner-13) case(set-16, for-14) det(set-16, the-15) nmod:for(partner-13, set-16) acl:relcl(mixer-10, asked-17) dobj(asked-17, me-18) ref(mixer-10, what-19) nmod:poss(major-21, my-20) nsubj(was-22, major-21) dep(asked-17, was-22) mark(learning-25, upon-24) acl(mixer-10, learning-25) mark(astrophysics-29, that-26) nsubj(astrophysics-29, it-27) cop(astrophysics-29, was-28) ccomp(learning-25, astrophysics-29) nsubj(walked-32, he-31) root(ROOT-0, walked-32) compound:prt(walked-32, off-33) det(floor-36, the-34) compound(floor-36, dance-35) dobj(walked-32, floor-36) advcl(walked-32, leaving-38) dobj(leaving-38, seven-39) case(us-41, of-40) nmod:of(seven-39, us-41) mark(improvise-43, to-42) advcl(leaving-38, improvise-43)  "
"<p> PHOTO ( BLACK &; WHITE ) : Dr. and Mrs. Greg C. Tansiongkun , FPSA , dancing on Thursday 's Fun Night .","<p>/NNP PHOTO/NNP -LRB-/-LRB- BLACK/CD &/CC ;/: WHITE/NNP -RRB-/-RRB- :/: Dr./NNP and/CC Mrs./NNP Greg/NNP C./NNP Tansiongkun/NNP ,/, FPSA/NNP ,/, dancing/VBG on/IN Thursday/NNP 's/POS Fun/NNP Night/NNP ./."," compound(PHOTO-2, <p>-1) root(ROOT-0, PHOTO-2) dep(PHOTO-2, BLACK-4) cc(BLACK-4, &-5) dep(BLACK-4, WHITE-7) dep(PHOTO-2, Dr.-10) cc(Dr.-10, and-11) compound(Tansiongkun-15, Mrs.-12) compound(Tansiongkun-15, Greg-13) compound(Tansiongkun-15, C.-14) dep(PHOTO-2, Tansiongkun-15) conj:and(Dr.-10, Tansiongkun-15) appos(Dr.-10, FPSA-17) acl(Dr.-10, dancing-19) case(Night-24, on-20) nmod:poss(Night-24, Thursday-21) case(Thursday-21, 's-22) compound(Night-24, Fun-23) nmod:on(dancing-19, Night-24)  "
"Because , when he was asked to recite his poems at parties , he got up and removed his coat and sang his lyrics aloud while dancing around the room , which is why he was subsequently not invited to parties anymore .","Because/IN ,/, when/WRB he/PRP was/VBD asked/VBN to/TO recite/VB his/PRP$ poems/NNS at/IN parties/NNS ,/, he/PRP got/VBD up/RP and/CC removed/VBD his/PRP$ coat/NN and/CC sang/VBD his/PRP$ lyrics/NNS aloud/RB while/IN dancing/VBG around/IN the/DT room/NN ,/, which/WDT is/VBZ why/WRB he/PRP was/VBD subsequently/RB not/RB invited/VBN to/TO parties/NNS anymore/RB ./."," nmod(got-15, Because-1) advmod(asked-6, when-3) nsubjpass(asked-6, he-4) nsubj(recite-8, he-4) auxpass(asked-6, was-5) advcl(got-15, asked-6) mark(recite-8, to-7) xcomp(asked-6, recite-8) nmod:poss(poems-10, his-9) dobj(recite-8, poems-10) case(parties-12, at-11) nmod:at(recite-8, parties-12) nsubj(got-15, he-14) nsubj(removed-18, he-14) root(ROOT-0, got-15) compound:prt(got-15, up-16) cc(got-15, and-17) conj:and(got-15, removed-18) nmod:poss(coat-20, his-19) dobj(removed-18, coat-20) cc(removed-18, and-21) conj:and(got-15, sang-22) conj:and(removed-18, sang-22) nmod:poss(lyrics-24, his-23) dobj(sang-22, lyrics-24) advmod(sang-22, aloud-25) mark(dancing-27, while-26) advcl(sang-22, dancing-27) case(room-30, around-28) det(room-30, the-29) nmod:around(dancing-27, room-30) nsubj(is-33, room-30) ref(room-30, which-32) acl:relcl(room-30, is-33) advmod(invited-39, why-34) nsubjpass(invited-39, he-35) auxpass(invited-39, was-36) advmod(invited-39, subsequently-37) neg(invited-39, not-38) advcl(is-33, invited-39) case(parties-41, to-40) nmod:to(invited-39, parties-41) advmod(invited-39, anymore-42)  "
"<p> According to Agnes de Mille , this search for the mot juste to conjure up for the blind Edward Sheldon a living image of Graham , or Markova , or Alonso , was the way in which de Mille herself learned to describe dancing .","<p>/RB According/VBG to/TO Agnes/NNP de/FW Mille/NNP ,/, this/DT search/NN for/IN the/DT mot/NN juste/VB to/TO conjure/VB up/RP for/IN the/DT blind/JJ Edward/NNP Sheldon/NNP a/DT living/VBG image/NN of/IN Graham/NNP ,/, or/CC Markova/NNP ,/, or/CC Alonso/NNP ,/, was/VBD the/DT way/NN in/IN which/WDT de/NNP Mille/NNP herself/PRP learned/VBD to/TO describe/VB dancing/NN ./."," advmod(juste-13, <p>-1) case(Mille-6, According-2) mwe(According-2, to-3) compound(Mille-6, Agnes-4) compound(Mille-6, de-5) nmod:according_to(juste-13, Mille-6) det(search-9, this-8) nsubj(juste-13, search-9) nsubj(conjure-15, search-9) case(mot-12, for-10) det(mot-12, the-11) nmod:for(search-9, mot-12) root(ROOT-0, juste-13) mark(conjure-15, to-14) xcomp(juste-13, conjure-15) compound:prt(conjure-15, up-16) case(Sheldon-21, for-17) det(Sheldon-21, the-18) amod(Sheldon-21, blind-19) compound(Sheldon-21, Edward-20) nmod:for(conjure-15, Sheldon-21) det(image-24, a-22) amod(image-24, living-23) dobj(conjure-15, image-24) case(Graham-26, of-25) nmod:of(image-24, Graham-26) cc(image-24, or-28) dobj(conjure-15, Markova-29) conj:or(image-24, Markova-29) nmod:in(learned-42, Markova-29) cc(Alonso-32, or-31) dep(Markova-29, Alonso-32) cop(way-36, was-34) det(way-36, the-35) acl:relcl(Markova-29, way-36) nmod:in(learned-42, way-36) case(which-38, in-37) ref(Markova-29, which-38) ref(way-36, which-38) compound(Mille-40, de-39) nsubj(learned-42, Mille-40) nsubj(describe-44, Mille-40) nmod:npmod(Mille-40, herself-41) acl:relcl(way-36, learned-42) mark(describe-44, to-43) xcomp(learned-42, describe-44) dobj(describe-44, dancing-45)  "
"My father , "" she wrote , "" considered dancing at best exhibitionistic acrobatics , and certainly a field that offered neither intellectual nor spiritual challenge . ""","My/PRP$ father/NN ,/, ''/'' she/PRP wrote/VBD ,/, ''/'' considered/VBD dancing/VBG at/IN best/JJS exhibitionistic/JJ acrobatics/NNS ,/, and/CC certainly/RB a/DT field/NN that/WDT offered/VBD neither/CC intellectual/JJ nor/CC spiritual/JJ challenge/NN ./. ''/''"," nmod:poss(father-2, My-1) nsubj(wrote-6, father-2) nsubj(wrote-6, she-5) ccomp(considered-9, wrote-6) root(ROOT-0, considered-9) xcomp(considered-9, dancing-10) case(acrobatics-14, at-11) amod(acrobatics-14, best-12) amod(acrobatics-14, exhibitionistic-13) dep(dancing-10, acrobatics-14) cc(acrobatics-14, and-16) dep(dancing-10, certainly-17) conj:and(acrobatics-14, certainly-17) det(field-19, a-18) nsubj(considered-9, field-19) nsubj(offered-21, that-20) ccomp(field-19, offered-21) cc:preconj(intellectual-23, neither-22) amod(challenge-26, intellectual-23) cc(intellectual-23, nor-24) conj:nor(intellectual-23, spiritual-25) amod(challenge-26, spiritual-25) dobj(offered-21, challenge-26)  "
The orthopedist advised ballet dancing .,The/DT orthopedist/NN advised/VBD ballet/JJ dancing/NN ./.," det(orthopedist-2, The-1) nsubj(advised-3, orthopedist-2) root(ROOT-0, advised-3) amod(dancing-5, ballet-4) dobj(advised-3, dancing-5)  "
"In a chapter called "" Ballet and Sex , "" from Dance to the Piper , she calls dancing a complete if unconscious substitute for physical love , observing that in the lives of most famous dancers it usually assumes this function .","In/IN a/DT chapter/NN called/VBN ''/'' Ballet/NN and/CC Sex/NN ,/, ''/'' from/IN Dance/VBG to/TO the/DT Piper/NNP ,/, she/PRP calls/VBZ dancing/VBG a/DT complete/JJ if/IN unconscious/JJ substitute/NN for/IN physical/JJ love/NN ,/, observing/VBG that/IN in/IN the/DT lives/NNS of/IN most/RBS famous/JJ dancers/NNS it/PRP usually/RB assumes/VBZ this/DT function/NN ./."," case(chapter-3, In-1) det(chapter-3, a-2) nmod:in(calls-18, chapter-3) acl(chapter-3, called-4) dobj(called-4, Ballet-6) cc(Ballet-6, and-7) dobj(called-4, Sex-8) conj:and(Ballet-6, Sex-8) mark(Dance-12, from-11) advcl(called-4, Dance-12) case(Piper-15, to-13) det(Piper-15, the-14) nmod:to(Dance-12, Piper-15) nsubj(calls-18, she-17) root(ROOT-0, calls-18) xcomp(calls-18, dancing-19) det(substitute-24, a-20) amod(substitute-24, complete-21) dep(unconscious-23, if-22) amod(substitute-24, unconscious-23) dobj(dancing-19, substitute-24) case(love-27, for-25) amod(love-27, physical-26) nmod:for(substitute-24, love-27) xcomp(calls-18, observing-29) mark(assumes-40, that-30) case(lives-33, in-31) det(lives-33, the-32) nmod:in(assumes-40, lives-33) case(dancers-37, of-34) advmod(famous-36, most-35) amod(dancers-37, famous-36) nmod:of(lives-33, dancers-37) nsubj(assumes-40, it-38) advmod(assumes-40, usually-39) ccomp(observing-29, assumes-40) det(function-42, this-41) dobj(assumes-40, function-42)  "
"In a half century things had changed very fast , first with Isadora Duncan dancing barefoot in a nightgown , and then Martha Graham 's maenads celebrating god-knows-what indecencies , rolling around on the stage .","In/IN a/DT half/NN century/NN things/NNS had/VBD changed/VBN very/RB fast/RB ,/, first/JJ with/IN Isadora/NNP Duncan/NNP dancing/VBG barefoot/NN in/IN a/DT nightgown/NN ,/, and/CC then/RB Martha/NNP Graham/NNP 's/POS maenads/NNS celebrating/VBG god-knows-what/JJ indecencies/NNS ,/, rolling/VBG around/RP on/IN the/DT stage/NN ./."," case(half-3, In-1) det(half-3, a-2) nmod:in(changed-7, half-3) compound(things-5, century-4) nsubj(changed-7, things-5) aux(changed-7, had-6) root(ROOT-0, changed-7) advmod(fast-9, very-8) advmod(changed-7, fast-9) advmod(changed-7, first-11) case(Duncan-14, with-12) compound(Duncan-14, Isadora-13) nmod:with(first-11, Duncan-14) acl(Duncan-14, dancing-15) dobj(dancing-15, barefoot-16) case(nightgown-19, in-17) det(nightgown-19, a-18) nmod:in(barefoot-16, nightgown-19) cc(changed-7, and-21) advmod(celebrating-27, then-22) compound(Graham-24, Martha-23) nmod:poss(maenads-26, Graham-24) case(Graham-24, 's-25) nsubj(celebrating-27, maenads-26) conj:and(changed-7, celebrating-27) amod(indecencies-29, god-knows-what-28) dobj(celebrating-27, indecencies-29) dep(celebrating-27, rolling-31) compound:prt(rolling-31, around-32) case(stage-35, on-33) det(stage-35, the-34) nmod:on(rolling-31, stage-35)  "
There her talent for writing and scholarship was immediately recognized and praised as her dancing had never been .,There/RB her/PRP$ talent/NN for/IN writing/NN and/CC scholarship/NN was/VBD immediately/RB recognized/VBN and/CC praised/VBN as/IN her/PRP$ dancing/NN had/VBD never/RB been/VBN ./.," advmod(recognized-10, There-1) nmod:poss(talent-3, her-2) nsubjpass(recognized-10, talent-3) nsubjpass(praised-12, talent-3) case(writing-5, for-4) nmod:for(talent-3, writing-5) cc(writing-5, and-6) nmod:for(talent-3, scholarship-7) conj:and(writing-5, scholarship-7) auxpass(recognized-10, was-8) advmod(recognized-10, immediately-9) root(ROOT-0, recognized-10) cc(recognized-10, and-11) conj:and(recognized-10, praised-12) mark(been-18, as-13) nmod:poss(dancing-15, her-14) nsubj(been-18, dancing-15) aux(been-18, had-16) neg(been-18, never-17) advcl(recognized-10, been-18)  "
"Then , in the late forties , she warily began her career as a writer , proposing to explain the mysteries of dancing to herself and the public .","Then/RB ,/, in/IN the/DT late/JJ forties/NNS ,/, she/PRP warily/RB began/VBD her/PRP$ career/NN as/IN a/DT writer/NN ,/, proposing/VBG to/TO explain/VB the/DT mysteries/NNS of/IN dancing/VBG to/TO herself/PRP and/CC the/DT public/NN ./."," advmod(began-10, Then-1) case(forties-6, in-3) det(forties-6, the-4) amod(forties-6, late-5) nmod:in(began-10, forties-6) nsubj(began-10, she-8) advmod(began-10, warily-9) root(ROOT-0, began-10) nmod:poss(career-12, her-11) dobj(began-10, career-12) case(writer-15, as-13) det(writer-15, a-14) nmod:as(began-10, writer-15) advcl(began-10, proposing-17) mark(explain-19, to-18) xcomp(proposing-17, explain-19) det(mysteries-21, the-20) dobj(explain-19, mysteries-21) mark(dancing-23, of-22) acl(mysteries-21, dancing-23) case(herself-25, to-24) nmod:to(dancing-23, herself-25) cc(herself-25, and-26) det(public-28, the-27) nmod:to(dancing-23, public-28) conj:and(herself-25, public-28)  "
For one thousand years there has been no dancing in the Christian religion and it is the only great religion that has had none .,For/IN one/CD thousand/CD years/NNS there/EX has/VBZ been/VBN no/DT dancing/NN in/IN the/DT Christian/JJ religion/NN and/CC it/PRP is/VBZ the/DT only/RB great/JJ religion/NN that/WDT has/VBZ had/VBN none/NN ./.," case(years-4, For-1) nummod(years-4, one-2) nummod(years-4, thousand-3) nmod:for(dancing-9, years-4) expl(dancing-9, there-5) aux(dancing-9, has-6) cop(dancing-9, been-7) neg(dancing-9, no-8) root(ROOT-0, dancing-9) case(religion-13, in-10) det(religion-13, the-11) amod(religion-13, Christian-12) nmod:in(dancing-9, religion-13) cc(dancing-9, and-14) nsubj(religion-20, it-15) cop(religion-20, is-16) det(religion-20, the-17) advmod(religion-20, only-18) amod(religion-20, great-19) conj:and(dancing-9, religion-20) nsubj(had-23, religion-20) ref(religion-20, that-21) aux(had-23, has-22) acl:relcl(religion-20, had-23) dobj(had-23, none-24)  "
"Her dancing grew ever more fierce , bound up , iron .","Her/PRP$ dancing/NN grew/VBD ever/RB more/RBR fierce/JJ ,/, bound/VBN up/RP ,/, iron/NN ./."," nmod:poss(dancing-2, Her-1) nsubj(grew-3, dancing-2) root(ROOT-0, grew-3) advmod(fierce-6, ever-4) advmod(fierce-6, more-5) xcomp(grew-3, fierce-6) dep(grew-3, bound-8) compound:prt(bound-8, up-9) dobj(grew-3, iron-11)  "
"The violin itself evolved out of several fiddlelike <p> Renaissance instruments , in particular the rebec and the lira da braccio ( literally , the arm lyre ) , used most commonly for dancing or for accompanying singers .","The/DT violin/NN itself/PRP evolved/VBD out/RP of/IN several/JJ fiddlelike/JJ <p>/NN Renaissance/NNP instruments/NNS ,/, in/IN particular/JJ the/DT rebec/NN and/CC the/DT lira/NN da/NN braccio/NN -LRB-/-LRB- literally/RB ,/, the/DT arm/NN lyre/NN -RRB-/-RRB- ,/, used/VBD most/RBS commonly/RB for/IN dancing/NN or/CC for/IN accompanying/VBG singers/NNS ./."," det(violin-2, The-1) nsubj(used-30, violin-2) nsubj(used-30', violin-2) nsubj(evolved-4, itself-3) parataxis(used-30, evolved-4) compound:prt(evolved-4, out-5) case(instruments-11, of-6) amod(instruments-11, several-7) amod(instruments-11, fiddlelike-8) compound(instruments-11, <p>-9) compound(instruments-11, Renaissance-10) nmod:of(evolved-4, instruments-11) case(rebec-16, in-13) amod(rebec-16, particular-14) det(rebec-16, the-15) nmod:in(evolved-4, rebec-16) cc(rebec-16, and-17) det(braccio-21, the-18) compound(braccio-21, lira-19) compound(braccio-21, da-20) nmod:in(evolved-4, braccio-21) conj:and(rebec-16, braccio-21) dep(lyre-27, literally-23) det(lyre-27, the-25) compound(lyre-27, arm-26) appos(braccio-21, lyre-27) root(ROOT-0, used-30) conj:or(used-30, used-30') advmod(commonly-32, most-31) advmod(used-30, commonly-32) case(dancing-34, for-33) nmod:for(used-30, dancing-34) cc(used-30, or-35) case(singers-38, for-36) amod(singers-38, accompanying-37) nmod:for(used-30', singers-38)  "
"The other type is called violin ; it is commonly used for dancing . """,The/DT other/JJ type/NN is/VBZ called/VBN violin/NN ;/: it/PRP is/VBZ commonly/RB used/VBN for/IN dancing/NN ./. ''/''," det(type-3, The-1) amod(type-3, other-2) nsubjpass(called-5, type-3) auxpass(called-5, is-4) root(ROOT-0, called-5) dobj(called-5, violin-6) nsubjpass(used-11, it-8) auxpass(used-11, is-9) advmod(used-11, commonly-10) parataxis(called-5, used-11) case(dancing-13, for-12) nmod:for(used-11, dancing-13)  "
