sent,tags,parse
"The music and the singing held us ; the dancing held us ; we could marvel at the religious dedication , "" he writes of a religious crusade . ""","The/DT music/NN and/CC the/DT singing/NN held/VBD us/PRP ;/: the/DT dancing/NN held/VBD us/PRP ;/: we/PRP could/MD marvel/VB at/IN the/DT religious/JJ dedication/NN ,/, ''/'' he/PRP writes/VBZ of/IN a/DT religious/JJ crusade/NN ./. ''/''","det(music-2, The-1) nsubj(held-6, music-2) cc(music-2, and-3) det(singing-5, the-4) conj:and(music-2, singing-5) nsubj(held-6, singing-5) root(ROOT-0, held-6) dobj(held-6, us-7) det(dancing-10, the-9) nsubj(held-11, dancing-10) parataxis(held-6, held-11) dobj(held-11, us-12) nsubj(marvel-16, we-14) aux(marvel-16, could-15) parataxis(held-6, marvel-16) case(dedication-20, at-17) det(dedication-20, the-18) amod(dedication-20, religious-19) nmod:at(marvel-16, dedication-20) nsubj(writes-24, he-23) parataxis(held-6, writes-24) case(crusade-28, of-25) det(crusade-28, a-26) amod(crusade-28, religious-27) nmod:of(writes-24, crusade-28)  "
And so it was with -- old-relief that I put an end to my pleasure in the singing and dancing .,And/CC so/RB it/PRP was/VBD with/IN --/: old-relief/NN that/IN I/PRP put/VBD an/DT end/NN to/TO my/PRP$ pleasure/NN in/IN the/DT singing/NN and/CC dancing/NN ./.,"cc(old-relief-7, And-1) advmod(old-relief-7, so-2) nsubj(old-relief-7, it-3) cop(old-relief-7, was-4) case(old-relief-7, with-5) root(ROOT-0, old-relief-7) mark(put-10, that-8) nsubj(put-10, I-9) dep(old-relief-7, put-10) det(end-12, an-11) dobj(put-10, end-12) case(pleasure-15, to-13) nmod:poss(pleasure-15, my-14) nmod:to(put-10, pleasure-15) case(singing-18, in-16) det(singing-18, the-17) nmod:in(put-10, singing-18) cc(singing-18, and-19) nmod:in(put-10, dancing-20) conj:and(singing-18, dancing-20)  "
Masked dancing figures and figures in a trance point to the persistence of this religion of early peoples .,Masked/JJ dancing/NN figures/NNS and/CC figures/NNS in/IN a/DT trance/NN point/VBP to/TO the/DT persistence/NN of/IN this/DT religion/NN of/IN early/JJ peoples/NNS ./.,"amod(figures-3, Masked-1) compound(figures-3, dancing-2) nsubj(point-9, figures-3) cc(figures-3, and-4) conj:and(figures-3, figures-5) nsubj(point-9, figures-5) case(trance-8, in-6) det(trance-8, a-7) nmod:in(figures-3, trance-8) root(ROOT-0, point-9) case(persistence-12, to-10) det(persistence-12, the-11) nmod:to(point-9, persistence-12) case(religion-15, of-13) det(religion-15, this-14) nmod:of(persistence-12, religion-15) case(peoples-18, of-16) amod(peoples-18, early-17) nmod:of(religion-15, peoples-18)  "
"<p> Cross-culturally there are four universal healing salves : singing , dancing , storytelling , and silence .","<p>/NNP Cross-culturally/NNP there/RB are/VBP four/CD universal/JJ healing/NN salves/NNS :/: singing/NN ,/, dancing/NN ,/, storytelling/NN ,/, and/CC silence/NN ./.","compound(Cross-culturally-2, <p>-1) nsubj(salves-8, Cross-culturally-2) advmod(salves-8, there-3) cop(salves-8, are-4) nummod(salves-8, four-5) amod(salves-8, universal-6) compound(salves-8, healing-7) root(ROOT-0, salves-8) dep(salves-8, singing-10) dep(salves-8, dancing-12) conj:and(singing-10, dancing-12) dep(salves-8, storytelling-14) conj:and(singing-10, storytelling-14) cc(singing-10, and-16) dep(salves-8, silence-17) conj:and(singing-10, silence-17)  "
""" Where in my life did I stop dancing ? """,''/UH Where/WRB in/IN my/PRP$ life/NN did/VBD I/PRP stop/VB dancing/NN ?/. ''/'',"discourse(stop-8, ''-1) advmod(stop-8, Where-2) case(life-5, in-3) nmod:poss(life-5, my-4) nmod:in(Where-2, life-5) aux(stop-8, did-6) nsubj(stop-8, I-7) root(ROOT-0, stop-8) dobj(stop-8, dancing-9)  "
"Shamanic societies believe that when an individual stops singing , dancing , being enchanted by stories , or is uncomfortable with silence , the individual experiences soul loss and opens doors to disease and discomfort .","Shamanic/JJ societies/NNS believe/VBP that/IN when/WRB an/DT individual/NN stops/VBZ singing/VBG ,/, dancing/VBG ,/, being/VBG enchanted/VBN by/IN stories/NNS ,/, or/CC is/VBZ uncomfortable/JJ with/IN silence/NN ,/, the/DT individual/NN experiences/VBZ soul/NN loss/NN and/CC opens/VBZ doors/NNS to/TO disease/NN and/CC discomfort/NN ./.","amod(societies-2, Shamanic-1) nsubj(believe-3, societies-2) root(ROOT-0, believe-3) mark(experiences-26, that-4) advmod(stops-8, when-5) det(individual-7, an-6) nsubj(stops-8, individual-7) advcl(experiences-26, stops-8) ccomp(stops-8, singing-9) dep(singing-9, dancing-11) auxpass(enchanted-14, being-13) dep(singing-9, enchanted-14) case(stories-16, by-15) nmod:by(enchanted-14, stories-16) cc(enchanted-14, or-18) cop(uncomfortable-20, is-19) dep(singing-9, uncomfortable-20) conj:or(enchanted-14, uncomfortable-20) case(silence-22, with-21) nmod:with(singing-9, silence-22) det(individual-25, the-24) nsubj(experiences-26, individual-25) nsubj(opens-30, individual-25) ccomp(believe-3, experiences-26) compound(loss-28, soul-27) dobj(experiences-26, loss-28) cc(experiences-26, and-29) ccomp(believe-3, opens-30) conj:and(experiences-26, opens-30) dobj(opens-30, doors-31) case(disease-33, to-32) nmod:to(opens-30, disease-33) cc(disease-33, and-34) nmod:to(opens-30, discomfort-35) conj:and(disease-33, discomfort-35)  "
"The initiant sits inside and drums , interspersed with dancing in the cemetery , over a seven-day period .","The/DT initiant/NN sits/VBZ inside/NN and/CC drums/NNS ,/, interspersed/VBN with/IN dancing/VBG in/IN the/DT cemetery/NN ,/, over/IN a/DT seven-day/JJ period/NN ./.","det(initiant-2, The-1) nsubj(sits-3, initiant-2) root(ROOT-0, sits-3) dobj(sits-3, inside-4) cc(inside-4, and-5) dobj(sits-3, drums-6) conj:and(inside-4, drums-6) acl(inside-4, interspersed-8) mark(dancing-10, with-9) advcl(interspersed-8, dancing-10) case(cemetery-13, in-11) det(cemetery-13, the-12) nmod:in(dancing-10, cemetery-13) case(period-18, over-15) det(period-18, a-16) amod(period-18, seven-day-17) nmod:over(inside-4, period-18)  "
"Even when the work is something made outside the artist ( as distinguished from , say , singing and dancing ) , if it is really a work of art , there is no way that the artist can not be present in that work .","Even/RB when/WRB the/DT work/NN is/VBZ something/NN made/VBN outside/IN the/DT artist/NN -LRB-/-LRB- as/RB distinguished/JJ from/IN ,/, say/VB ,/, singing/VBG and/CC dancing/VBG -RRB-/-RRB- ,/, if/IN it/PRP is/VBZ really/RB a/DT work/NN of/IN art/NN ,/, there/EX is/VBZ no/DT way/NN that/IN the/DT artist/NN can/MD not/RB be/VB present/JJ in/IN that/DT work/NN ./.","advmod(something-6, Even-1) advmod(something-6, when-2) det(work-4, the-3) nsubj(something-6, work-4) cop(something-6, is-5) advcl(is-33, something-6) acl(something-6, made-7) case(artist-10, outside-8) det(artist-10, the-9) nmod:outside(made-7, artist-10) advmod(distinguished-13, as-12) dep(made-7, distinguished-13) case(singing-18, from-14) discourse(singing-18, say-16) advcl:from(distinguished-13, singing-18) cc(singing-18, and-19) advcl:from(distinguished-13, dancing-20) conj:and(singing-18, dancing-20) mark(work-28, if-23) nsubj(work-28, it-24) cop(work-28, is-25) advmod(work-28, really-26) det(work-28, a-27) advcl(is-33, work-28) case(art-30, of-29) nmod:of(work-28, art-30) expl(is-33, there-32) root(ROOT-0, is-33) neg(way-35, no-34) advmod(is-33, way-35) mark(present-42, that-36) det(artist-38, the-37) nsubj(present-42, artist-38) aux(present-42, can-39) neg(present-42, not-40) cop(present-42, be-41) ccomp(way-35, present-42) case(work-45, in-43) det(work-45, that-44) nmod:in(present-42, work-45)  "
"( n28 ) Baron de Tott 's memoirs describe the outbreak of "" war "" at Galata between Ottoman janissaries and naval troops equally enamored of a 13- or 14-year-old dancing boy.",-LRB-/-LRB- n28/NNP -RRB-/-RRB- Baron/NNP de/IN Tott/NNP 's/POS memoirs/NNS describe/VBP the/DT outbreak/NN of/IN ''/'' war/NN ''/'' at/IN Galata/NNP between/IN Ottoman/NNP janissaries/NNS and/CC naval/JJ troops/NNS equally/RB enamored/JJ of/IN a/DT 13/CD -/: or/CC 14-year-old/JJ dancing/NN boy/NN ./.,"compound(Baron-4, n28-2) nsubj(describe-9, Baron-4) case(memoirs-8, de-5) nmod:poss(memoirs-8, Tott-6) case(Tott-6, 's-7) nmod:de(Baron-4, memoirs-8) root(ROOT-0, describe-9) det(outbreak-11, the-10) dobj(describe-9, outbreak-11) case(war-14, of-12) nmod:of(outbreak-11, war-14) case(Galata-17, at-16) nmod:at(outbreak-11, Galata-17) case(janissaries-20, between-18) compound(janissaries-20, Ottoman-19) nmod:between(Galata-17, janissaries-20) cc(outbreak-11, and-21) amod(troops-23, naval-22) dobj(describe-9, troops-23) conj:and(outbreak-11, troops-23) advmod(enamored-25, equally-24) amod(troops-23, enamored-25) case(13-28, of-26) det(13-28, a-27) nmod:of(troops-23, 13-28) cc(outbreak-11, or-30) amod(boy-33, 14-year-old-31) compound(boy-33, dancing-32) dobj(describe-9, boy-33) conj:or(outbreak-11, boy-33)  "
"<p> HOMOSEXUALITY AND OTTOMAN MILITARY SOCIETY <p> A number of the European accounts and other sources previously referred to have emphasized homosexual practices as an aspect of or , indeed , as originating with , Arab or Muslim conquering elites and military or slave societies Thus , boys accompanied Moroccan armies to provide sexual services ; ( n84 ) "" the militarization of the highest social classes contributed to a pattern of homosexual relations with its stress on masculine society "" ; ( n85 ) rivalry among Ottoman troops for the favors of a dancing boy resulted in rioting ; ( n86 ) and the "" cult "" of male youths was a "" privilege "" of "" warlike conquerors . ""","<p>/NNP HOMOSEXUALITY/NNP AND/CC OTTOMAN/NNP MILITARY/NNP SOCIETY/NNP <p>/VBP A/DT number/NN of/IN the/DT European/JJ accounts/NNS and/CC other/JJ sources/NNS previously/RB referred/VBD to/TO have/VB emphasized/VBN homosexual/JJ practices/NNS as/IN an/DT aspect/NN of/IN or/CC ,/, indeed/RB ,/, as/IN originating/NNP with/IN ,/, Arab/JJ or/CC Muslim/JJ conquering/NN elites/NNS and/CC military/NN or/CC slave/NN societies/NNS Thus/RB ,/, boys/NNS accompanied/VBN Moroccan/JJ armies/NNS to/TO provide/VB sexual/JJ services/NNS ;/: -LRB-/-LRB- n84/NNP -RRB-/-RRB- ''/'' the/DT militarization/NN of/IN the/DT highest/JJS social/JJ classes/NNS contributed/VBN to/TO a/DT pattern/NN of/IN homosexual/JJ relations/NNS with/IN its/PRP$ stress/NN on/IN masculine/JJ society/NN ''/'' ;/: -LRB-/-LRB- n85/JJ -RRB-/-RRB- rivalry/NN among/IN Ottoman/NNP troops/NNS for/IN the/DT favors/NNS of/IN a/DT dancing/NN boy/NN resulted/VBN in/IN rioting/NN ;/: -LRB-/-LRB- n86/NNP -RRB-/-RRB- and/CC the/NN ''/'' cult/NN ''/'' of/IN male/JJ youths/NNS was/VBD a/NNP ''/'' privilege/NNP ''/'' of/IN ''/'' warlike/JJ conquerors/NNS ./. ''/''","compound(HOMOSEXUALITY-2, <p>-1) nsubj(<p>-7, HOMOSEXUALITY-2) cc(HOMOSEXUALITY-2, AND-3) compound(SOCIETY-6, OTTOMAN-4) compound(SOCIETY-6, MILITARY-5) conj:and(HOMOSEXUALITY-2, SOCIETY-6) nsubj(<p>-7, SOCIETY-6) root(ROOT-0, <p>-7) det(number-9, A-8) dobj(<p>-7, number-9) case(accounts-13, of-10) det(accounts-13, the-11) amod(accounts-13, European-12) nmod:of(number-9, accounts-13) cc(<p>-7, and-14) amod(sources-16, other-15) nsubj(referred-18, sources-16) nsubj(emphasized-21, sources-16) advmod(referred-18, previously-17) conj:and(<p>-7, referred-18) mark(emphasized-21, to-19) aux(emphasized-21, have-20) xcomp(referred-18, emphasized-21) amod(practices-23, homosexual-22) dobj(emphasized-21, practices-23) case(aspect-26, as-24) det(aspect-26, an-25) nmod:as(emphasized-21, aspect-26) acl(aspect-26, of-27) cc(referred-18, or-28) conj:and(<p>-7, indeed-30) conj:or(referred-18, indeed-30) mark(privilege-115, as-32) nsubj(privilege-115, originating-33) case(boys-48, with-34) amod(elites-40, Arab-36) cc(Arab-36, or-37) conj:or(Arab-36, Muslim-38) amod(elites-40, Muslim-38) compound(elites-40, conquering-39) nmod:npmod(Thus-46, elites-40) cc(elites-40, and-41) compound(societies-45, military-42) cc(military-42, or-43) conj:or(military-42, slave-44) compound(societies-45, slave-44) conj:and(elites-40, societies-45) nmod:npmod(Thus-46, societies-45) advmod(boys-48, Thus-46) nmod:with(originating-33, boys-48) acl(boys-48, accompanied-49) amod(armies-51, Moroccan-50) dobj(accompanied-49, armies-51) mark(provide-53, to-52) acl(armies-51, provide-53) amod(services-55, sexual-54) iobj(provide-53, services-55) appos(services-55, n84-58) det(militarization-62, the-61) dobj(provide-53, militarization-62) case(classes-67, of-63) det(classes-67, the-64) amod(classes-67, highest-65) amod(classes-67, social-66) nmod:of(militarization-62, classes-67) acl(classes-67, contributed-68) case(pattern-71, to-69) det(pattern-71, a-70) nmod:to(contributed-68, pattern-71) case(relations-74, of-72) amod(relations-74, homosexual-73) nmod:of(pattern-71, relations-74) case(stress-77, with-75) nmod:poss(stress-77, its-76) nmod:with(contributed-68, stress-77) case(society-80, on-78) amod(society-80, masculine-79) nmod:on(stress-77, society-80) amod(rivalry-86, n85-84) dep(society-80, rivalry-86) case(troops-89, among-87) compound(troops-89, Ottoman-88) nmod:among(rivalry-86, troops-89) case(favors-92, for-90) det(favors-92, the-91) nmod:for(troops-89, favors-92) case(boy-96, of-93) det(boy-96, a-94) compound(boy-96, dancing-95) nmod:of(favors-92, boy-96) acl(boy-96, resulted-97) case(rioting-99, in-98) nmod:in(resulted-97, rioting-99) appos(armies-51, n86-102) cc(armies-51, and-104) compound(cult-107, the-105) dobj(accompanied-49, cult-107) conj:and(armies-51, cult-107) case(youths-111, of-109) amod(youths-111, male-110) nmod:of(cult-107, youths-111) cop(privilege-115, was-112) compound(privilege-115, a-113) advcl(indeed-30, privilege-115) case(conquerors-120, of-117) amod(conquerors-120, warlike-119) nmod:of(privilege-115, conquerors-120)  "
"This led to dancing in the streets with hundreds chanting "" Kaunda walala "" -- Kaunda is finished -- until it was discovered that it was not true , at which point everyone went back to business as usual.","This/DT led/VBD to/TO dancing/VB in/IN the/DT streets/NNS with/IN hundreds/NNS chanting/VBG ''/'' Kaunda/NNP walala/NNP ''/'' --/: Kaunda/NNP is/VBZ finished/VBN --/: until/IN it/PRP was/VBD discovered/VBN that/IN it/PRP was/VBD not/RB true/JJ ,/, at/IN which/WDT point/NN everyone/NN went/VBD back/RP to/TO business/NN as/IN usual/JJ ./.","nsubj(led-2, This-1) nsubj(dancing-4, This-1) root(ROOT-0, led-2) mark(dancing-4, to-3) xcomp(led-2, dancing-4) case(streets-7, in-5) det(streets-7, the-6) nmod:in(dancing-4, streets-7) case(hundreds-9, with-8) nmod:with(dancing-4, hundreds-9) acl(hundreds-9, chanting-10) compound(walala-13, Kaunda-12) dobj(chanting-10, walala-13) nsubjpass(finished-18, Kaunda-16) auxpass(finished-18, is-17) parataxis(led-2, finished-18) mark(discovered-23, until-20) nsubjpass(discovered-23, it-21) auxpass(discovered-23, was-22) advcl(led-2, discovered-23) mark(true-28, that-24) nsubj(true-28, it-25) cop(true-28, was-26) neg(true-28, not-27) ccomp(discovered-23, true-28) mark(went-34, at-30) dobj(went-34, which-31) compound(everyone-33, point-32) nsubj(went-34, everyone-33) advcl(true-28, went-34) compound:prt(went-34, back-35) case(business-37, to-36) nmod:to(went-34, business-37) case(usual-39, as-38) advcl:as(went-34, usual-39)  "
"We have had , to be sure , a good basic course in those three literatures , enough to enable us to find similarities and parallels with western works that we know much better , and we have the tools of our trade , the critical and theoretical approaches and the toe-dancing wit we already use in teaching and writing about Chaucer , Shakespeare , Milton , Wordsworth , and the rest of the canonical crew .","We/PRP have/VBP had/VBN ,/, to/TO be/VB sure/JJ ,/, a/DT good/JJ basic/JJ course/NN in/IN those/DT three/CD literatures/NNS ,/, enough/RB to/TO enable/VB us/PRP to/TO find/VB similarities/NNS and/CC parallels/NNS with/IN western/JJ works/NNS that/IN we/PRP know/VBP much/RB better/JJR ,/, and/CC we/PRP have/VBP the/DT tools/NNS of/IN our/PRP$ trade/NN ,/, the/DT critical/JJ and/CC theoretical/JJ approaches/NNS and/CC the/DT toe-dancing/JJ wit/NN we/PRP already/RB use/VBP in/IN teaching/VBG and/CC writing/VBG about/IN Chaucer/NNP ,/, Shakespeare/NNP ,/, Milton/NNP ,/, Wordsworth/NNP ,/, and/CC the/DT rest/NN of/IN the/DT canonical/JJ crew/NN ./.","nsubj(had-3, We-1) nsubj(sure-7, We-1) aux(had-3, have-2) root(ROOT-0, had-3) mark(sure-7, to-5) cop(sure-7, be-6) xcomp(had-3, sure-7) det(course-12, a-9) amod(course-12, good-10) amod(course-12, basic-11) dep(sure-7, course-12) case(literatures-16, in-13) det(literatures-16, those-14) nummod(literatures-16, three-15) nmod:in(course-12, literatures-16) advmod(sure-7, enough-18) mark(enable-20, to-19) dep(enough-18, enable-20) dobj(enable-20, us-21) nsubj(find-23, us-21) mark(find-23, to-22) xcomp(enable-20, find-23) dobj(find-23, similarities-24) cc(similarities-24, and-25) dobj(find-23, parallels-26) conj:and(similarities-24, parallels-26) case(works-29, with-27) amod(works-29, western-28) nmod:with(find-23, works-29) mark(know-32, that-30) nsubj(know-32, we-31) ccomp(find-23, know-32) advmod(better-34, much-33) xcomp(know-32, better-34) cc(had-3, and-36) nsubj(have-38, we-37) conj:and(had-3, have-38) det(tools-40, the-39) dobj(have-38, tools-40) case(trade-43, of-41) nmod:poss(trade-43, our-42) nmod:of(tools-40, trade-43) det(approaches-49, the-45) amod(approaches-49, critical-46) cc(critical-46, and-47) conj:and(critical-46, theoretical-48) amod(approaches-49, theoretical-48) dobj(have-38, approaches-49) conj:and(tools-40, approaches-49) cc(tools-40, and-50) det(wit-53, the-51) amod(wit-53, toe-dancing-52) dobj(have-38, wit-53) conj:and(tools-40, wit-53) nsubj(use-56, we-54) advmod(use-56, already-55) acl:relcl(wit-53, use-56) mark(teaching-58, in-57) advcl(use-56, teaching-58) cc(teaching-58, and-59) advcl(use-56, writing-60) conj:and(teaching-58, writing-60) case(Wordsworth-68, about-61) compound(Wordsworth-68, Chaucer-62) appos(Wordsworth-68, Shakespeare-64) appos(Wordsworth-68, Milton-66) nmod:about(teaching-58, Wordsworth-68) cc(wit-53, and-70) det(rest-72, the-71) conj:and(tools-40, rest-72) conj:and(wit-53, rest-72) case(crew-76, of-73) det(crew-76, the-74) amod(crew-76, canonical-75) nmod:of(rest-72, crew-76)  "
"Thus , the yeik utee dancers hide behind a blanket , with only their bobbing shakee.at headdresses rising above it , hiding the dancers ' identity and emphasizing that they are only impersonating the spirits.6 When the dancing is over , the blanket is used to wipe the sweat off the faces of the dancers and is then presented as a gift to one of the distinguished guests .","Thus/RB ,/, the/DT yeik/NN utee/VBP dancers/NNS hide/VB behind/IN a/DT blanket/NN ,/, with/IN only/RB their/PRP$ bobbing/JJ shakee.at/NN headdresses/NNS rising/VBG above/IN it/PRP ,/, hiding/VBG the/DT dancers/NNS '/POS identity/NN and/CC emphasizing/VBG that/IN they/PRP are/VBP only/RB impersonating/VBG the/DT spirits/NNS .6/CD When/WRB the/DT dancing/NN is/VBZ over/RP ,/, the/DT blanket/NN is/VBZ used/VBN to/TO wipe/VB the/DT sweat/NN off/IN the/DT faces/NNS of/IN the/DT dancers/NNS and/CC is/VBZ then/RB presented/VBN as/IN a/DT gift/NN to/TO one/CD of/IN the/DT distinguished/VBN guests/NNS ./.","advmod(used-46, Thus-1) det(yeik-4, the-3) nsubj(utee-5, yeik-4) parataxis(used-46, utee-5) nsubj(hide-7, dancers-6) ccomp(utee-5, hide-7) case(blanket-10, behind-8) det(blanket-10, a-9) nmod:behind(hide-7, blanket-10) mark(rising-18, with-12) advmod(headdresses-17, only-13) nmod:poss(headdresses-17, their-14) amod(headdresses-17, bobbing-15) compound(headdresses-17, shakee.at-16) nsubj(rising-18, headdresses-17) nsubj(hiding-22, headdresses-17) nsubj(emphasizing-28, headdresses-17) advcl(utee-5, rising-18) case(it-20, above-19) nmod:above(rising-18, it-20) advcl(utee-5, hiding-22) conj:and(rising-18, hiding-22) det(dancers-24, the-23) nmod:poss(identity-26, dancers-24) case(dancers-24, '-25) dobj(hiding-22, identity-26) cc(rising-18, and-27) advcl(utee-5, emphasizing-28) conj:and(rising-18, emphasizing-28) mark(impersonating-33, that-29) nsubj(impersonating-33, they-30) aux(impersonating-33, are-31) advmod(impersonating-33, only-32) ccomp(emphasizing-28, impersonating-33) det(spirits-35, the-34) dobj(impersonating-33, spirits-35) nmod:tmod(impersonating-33, .6-36) advmod(over-41, When-37) det(dancing-39, the-38) nsubj(over-41, dancing-39) cop(over-41, is-40) acl:relcl(.6-36, over-41) det(blanket-44, the-43) nsubjpass(used-46, blanket-44) nsubj(wipe-48, blanket-44) nsubjpass(presented-60, blanket-44) auxpass(used-46, is-45) root(ROOT-0, used-46) mark(wipe-48, to-47) xcomp(used-46, wipe-48) det(sweat-50, the-49) dobj(wipe-48, sweat-50) case(faces-53, off-51) det(faces-53, the-52) nmod:off(wipe-48, faces-53) case(dancers-56, of-54) det(dancers-56, the-55) nmod:of(faces-53, dancers-56) cc(used-46, and-57) auxpass(presented-60, is-58) advmod(presented-60, then-59) conj:and(used-46, presented-60) case(gift-63, as-61) det(gift-63, a-62) nmod:as(presented-60, gift-63) case(one-65, to-64) nmod:to(presented-60, one-65) case(guests-69, of-66) det(guests-69, the-67) amod(guests-69, distinguished-68) nmod:of(one-65, guests-69)  "
"While the teaching of the Tlingit language has had a rather limited success , 8 traditional carving , beadwork and other visual arts , as well as singing and dancing have experienced a significant revival .","While/IN the/DT teaching/NN of/IN the/DT Tlingit/NNP language/NN has/VBZ had/VBN a/DT rather/RB limited/JJ success/NN ,/, 8/CD traditional/JJ carving/NNS ,/, beadwork/NN and/CC other/JJ visual/JJ arts/NNS ,/, as/RB well/RB as/IN singing/NN and/CC dancing/NN have/VBP experienced/VBN a/DT significant/JJ revival/NN ./.","mark(had-9, While-1) det(teaching-3, the-2) nsubj(had-9, teaching-3) case(language-7, of-4) det(language-7, the-5) compound(language-7, Tlingit-6) nmod:of(teaching-3, language-7) aux(had-9, has-8) advcl(experienced-32, had-9) det(success-13, a-10) advmod(limited-12, rather-11) amod(success-13, limited-12) dobj(had-9, success-13) nummod(carving-17, 8-15) amod(carving-17, traditional-16) nsubj(experienced-32, carving-17) conj:and(carving-17, beadwork-19) nsubj(experienced-32, beadwork-19) cc(carving-17, and-20) amod(arts-23, other-21) amod(arts-23, visual-22) conj:and(carving-17, arts-23) nsubj(experienced-32, arts-23) cc(carving-17, as-25) mwe(as-25, well-26) mwe(as-25, as-27) conj:and(carving-17, singing-28) nsubj(experienced-32, singing-28) cc(singing-28, and-29) conj:and(carving-17, dancing-30) conj:and(singing-28, dancing-30) aux(experienced-32, have-31) root(ROOT-0, experienced-32) det(revival-35, a-33) amod(revival-35, significant-34) dobj(experienced-32, revival-35)  "
"However , confronted by a choice between remaining loyal to the indigenous law and seeing traditional singing and dancing decline further , and violating that law for the sake of preserving the ancestral heritage , he chose the latter .","However/RB ,/, confronted/VBN by/IN a/DT choice/NN between/IN remaining/VBG loyal/JJ to/TO the/DT indigenous/JJ law/NN and/CC seeing/VBG traditional/JJ singing/NN and/CC dancing/VBG decline/NN further/RBR ,/, and/CC violating/VBG that/DT law/NN for/IN the/DT sake/NN of/IN preserving/VBG the/DT ancestral/JJ heritage/NN ,/, he/PRP chose/VBD the/DT latter/NN ./.","advmod(chose-37, However-1) advcl(chose-37, confronted-3) case(choice-6, by-4) det(choice-6, a-5) nmod:by(confronted-3, choice-6) mark(remaining-8, between-7) acl(choice-6, remaining-8) xcomp(remaining-8, loyal-9) case(law-13, to-10) det(law-13, the-11) amod(law-13, indigenous-12) nmod:to(loyal-9, law-13) cc(remaining-8, and-14) acl(choice-6, seeing-15) conj:and(remaining-8, seeing-15) amod(singing-17, traditional-16) dobj(seeing-15, singing-17) cc(seeing-15, and-18) conj:and(remaining-8, dancing-19) conj:and(seeing-15, dancing-19) dobj(dancing-19, decline-20) advmod(dancing-19, further-21) cc(remaining-8, and-23) acl(choice-6, violating-24) conj:and(remaining-8, violating-24) det(law-26, that-25) dobj(violating-24, law-26) case(sake-29, for-27) det(sake-29, the-28) nmod:for(law-26, sake-29) mark(preserving-31, of-30) acl(sake-29, preserving-31) det(heritage-34, the-32) amod(heritage-34, ancestral-33) dobj(preserving-31, heritage-34) nsubj(chose-37, he-36) root(ROOT-0, chose-37) det(latter-39, the-38) dobj(chose-37, latter-39)  "
